<?xml version="1.0" encoding="UTF-8"?>
<component xmlns:xsi="http://www.w3.org/2001/XMLSchema-instance"
         xsi:noNamespaceSchemaLocation="../../models/components.xsd"
         name="InputTextfieldBlock" 
         type="classic" >
    
    <selectors>
        <selector id="wrapper">div.wrapper</selector>
        <selector id="head">div.wrapper > div.head</selector>
        <selector id="label">div.wrapper > div.head > label</selector>
        <selector id="description">div.wrapper > div.head > span</selector>
        <selector id="input">div.wrapper > div.input</selector>
        <selector id="field">div.wrapper > div.input > input</selector>
        <selector id="icons">div.wrapper > div.input > div.icon</selector>
        <selector id="locked">div.wrapper > div.input > div.icon.locked</selector>
        <selector id="ok">div.wrapper > div.input > div.icon.ok</selector>
        <selector id="ko">div.wrapper > div.input > div.icon.ko</selector>
        <selector id="focus">div.wrapper > div.input > div.icon.focus</selector>
        <selector id="loading">div.wrapper > div.input > div.icon.loading</selector>
        <selector id="foot">div.wrapper > div.foot</selector>
    </selectors>
    <trajectories>
        <trajectory name="fadein">
            <speed>320</speed>
            <easing>easeInQuart</easing>
            <move>
                <property>opacity</property>
                <from>0</from>
                <to>1</to>
            </move>
        </trajectory>
        <trajectory name="fadeout">
            <speed>320</speed>
            <easing>easeOutQuart</easing>
            <move>
                <property>opacity</property>
                <from>1</from>
                <to>0</to>
            </move>
        </trajectory>
        <trajectory name="flag">
            <speed>240</speed>
            <easing>easeOutQuint</easing>
            <move>
                <property>opacity</property>
                <from>0</from>
                <to>1</to>
            </move>
            <move>
                <property>right</property>
                <from>96px</from>
                <to>32px</to>
            </move>
        </trajectory>
        <trajectory name="unflag">
            <speed>160</speed>
            <easing>easeInQuint</easing>
            <move>
                <property>opacity</property>
                <from>1</from>
                <to>0</to>
            </move>
            <move>
                <property>right</property>
                <from>32px</from>
                <to>0px</to>
            </move>
        </trajectory>
        <trajectory name="lock">
            <speed>200</speed>
            <easing>swing</easing>
            <move>
                <property>background-color</property>
                <to>#666</to>
            </move>
            <move>
                <property>color</property>
                <to>#eee</to>
            </move>
        </trajectory>
        <trajectory name="unlock">
            <speed>200</speed>
            <easing>swing</easing>
            <move>
                <property>background-color</property>
                <to>#eee</to>
            </move>
            <move>
                <property>color</property>
                <to>#666</to>
            </move>
        </trajectory>
    </trajectories>
    <loader>
        <dom>
            <![CDATA[
                <div class="wrapper">
                    <div class="head">
                        <label />
                        <span />
                    </div>
                    <div class="input">
                        <input type="textfield" />
                        <div class="icon focus" />
                        <div class="icon ok" />
                        <div class="icon ko" />
                        <div class="icon loading" />
                        <div class="icon locked" />
                    </div>
                    <div class="foot">-</div>
                </div>
            ]]>
        </dom>
        <action call="init" />
        <to>Initial</to>
    </loader>
    <state id="Initial">
        <trigger bind="focus">
            <target>field</target>
            <action call="select" />
            <action call="go">
                <parameter>Focus</parameter>
            </action>
        </trigger>
        <in>
            <target>wrapper</target>
            <pre call="width">
                <parameter>field</parameter>
                <parameter>-16</parameter>
            </pre>
            <pre call="center">
                <parameter>field</parameter>
            </pre>
            <pre call="center">
                <parameter>icons</parameter>
            </pre>
            <pre call="attribute">
                <parameter>field</parameter>
                <parameter>disabled</parameter>
                <parameter>disabled</parameter>
            </pre>
            <animation base="fadein" />
            <post call="attribute">
                <parameter>field</parameter>
                <parameter>disabled</parameter>
            </post>
        </in>
        <begin call="refocus" />
    </state>
    <state id="Empty">
        <begin call="check" />
    </state>
    <state id="Focus">
        <trigger bind="blur">
            <target>field</target>
            <action call="validate" />
        </trigger>
        <in>
            <target>focus</target>
            <animation base="flag" />
        </in>
        <begin call="refocus" />
        <out>
            <target>focus</target>
            <animation base="unflag" />
        </out>
    </state>
    <state id="Ok">
        <trigger bind="focus">
            <target>field</target>
            <action call="go">
                <parameter>Focus</parameter>
            </action>
        </trigger>
        <in>
            <target>ok</target>
            <animation base="flag" />
        </in>
        <begin call="refocus" />
        <out>
            <target>ok</target>
            <animation base="unflag" />
        </out>
    </state>
    <state id="Ko">
        <trigger bind="focus">
            <target>field</target>
            <action call="go">
                <parameter>Focus</parameter>
            </action>
        </trigger>
        <in>
            <target>ko</target>
            <animation base="flag" />
        </in>
        <in>
            <target>foot</target>
            <animation base="fadein" />
        </in>
        <begin call="refocus" />
        <out>
            <target>ko</target>
            <animation base="unflag" />
        </out>
        <out>
            <target>foot</target>
            <animation base="fadeout" />
        </out>
    </state>
    <state id="Checking">
        <in>
            <target>loading</target>
            <animation base="flag" />
        </in>
        <begin call="check" />
        <out>
            <target>loading</target>
            <animation base="unflag" />
        </out>
    </state>
    <state id="Locked">
        <in>
            <target>locked</target>
            <animation base="flag" />
        </in>
        <in>
            <target>field</target>
            <animation base="lock" />
        </in>
        <begin call="attribute">
            <parameter>field</parameter>
            <parameter>disabled</parameter>
            <parameter>disabled</parameter>
        </begin>
        <out>
            <target>field</target>
            <animation base="unlock" />
        </out>
        <out>
            <target>locked</target>
            <animation base="unflag" />
        </out>
        <conclude call="attribute">
            <parameter>field</parameter>
            <parameter>disabled</parameter>
        </conclude>
    </state>
</component>